{
  "absolute_runtime_path_in_canonical_identity_count": 0,
  "accepted_closures": 745,
  "atr_events_generated": false,
  "b2_evidence": {
    "canonical_summary_sha256": "bc6fafc40b9c550a7d9d7e798a92a6f685e5de208c7c224c738726bce00608a0",
    "compact_result_schema_validated": true,
    "contract_result_projection_match": true,
    "contract_schema_validated": true,
    "decision": "FR_PREP_B2_PASS_FROZEN_FJ_BACKWARD_COMPATIBLE_REPLAY"
  },
  "candidate": "NOT_READY_FOR_ORDER_LOGIC",
  "candidate_row_order_canonical": true,
  "canonical_summary_sha256": "1f63983bf783452bd0e56d6c265f67f3baccbaae644eedcacb59a1f79a895251",
  "checkpoint": "FR_PREP_B2A",
  "decision": "FR_PREP_B2A_PASS_INDEPENDENT_REPLAY_AUDIT",
  "ea_executed": false,
  "event_count": 1079,
  "event_ids_unique": true,
  "event_row_order_canonical": true,
  "execution_status": "PASS",
  "fn_interpretation_performed": false,
  "fq_accessed": false,
  "gap_count": 773,
  "long_count": 588,
  "mismatch_counters": {
    "count_mismatch": 0,
    "hash_mismatch": 0,
    "identity_mismatch": 0,
    "negative_test_mismatch": 0,
    "ordering_mismatch": 0,
    "relocation_mismatch": 0,
    "repeat_mismatch": 0,
    "uniqueness_mismatch": 0
  },
  "mt5_executed": false,
  "negative_tests": {
    "all_passed": true,
    "results": {
      "absolute_path_detected": true,
      "altered_row_detected": true,
      "changed_count_detected": true,
      "changed_hash_detected": true,
      "external_launch_blocked": true,
      "fq_access_blocked": true,
      "reordered_rows_detected": true,
      "wrong_decision_detected": true
    },
    "test_count": 8,
    "tests_passed": 8
  },
  "normal_repeat_identical": true,
  "order_logic": "NOT_APPROVED",
  "outcomes_generated": false,
  "profitability": "NOT_CLAIMED",
  "prohibited_modules": [],
  "recomputed_hashes": {
    "event_population_sha256": "db59643834e06acbfebb66026634f4f561fb9b07131fdca1513e3585cd51c74b",
    "exclusion_population_sha256": "1a150cfc3ae0f338e0f43710187c9bc6363e32dd453fd85a9e5f4a231e4952ed",
    "population_summary_sha256": "5a45eb6e58b7b38764c6ecbf51fbf6e8472c702b8ebe28c97bee9beafcfba408",
    "terminal_status_summary_sha256": "b9edb4f6455d4742e9e77f1d3b23b920c145cc1b3eee3d53eed9d1b05235b1ef"
  },
  "relocation_identical": true,
  "runtime_audit": {
    "counter_provenance": {
      "executions": "no prohibited execution dispatch exists",
      "external_process": "Popen, os.system and os.startfile interception",
      "file_access": "exact resolved-path read dispatch",
      "module_imports": "sys.modules before/after delta and final prohibited-module absence"
    },
    "external_process": {
      "blocked_attempt_categories": [
        "subprocess:MT5_OR_EA"
      ],
      "blocked_external_launch_attempt_count": 1,
      "successful_ea_execution_count": 0,
      "successful_external_process_launch_count": 0,
      "successful_mt5_launch_count": 0
    },
    "file_access": {
      "blocked_attempt_categories": [
        "FQ_PATH"
      ],
      "blocked_unauthorized_read_attempt_count": 1,
      "fq_successful_read_count": 0,
      "raw_read_operation_counts": {
        "b2_contract": 6,
        "b2_result": 5,
        "b2_schema": 5,
        "b2a_authorization": 1,
        "b2a_authorization_schema": 1,
        "b2a_evidence_schema": 1,
        "committed_candidate_population": 5,
        "committed_deterministic_replay": 5,
        "committed_event_population": 5,
        "committed_population_summary": 5,
        "relocated_committed_artifacts": 14
      },
      "unauthorized_successful_read_count": 0,
      "unique_logical_file_counts": {
        "b2_contract": 1,
        "b2_result": 1,
        "b2_schema": 1,
        "b2a_authorization": 1,
        "b2a_authorization_schema": 1,
        "b2a_evidence_schema": 1,
        "committed_candidate_population": 1,
        "committed_deterministic_replay": 1,
        "committed_event_population": 1,
        "committed_population_summary": 1,
        "relocated_committed_artifacts": 7
      }
    },
    "module_import_counts": {
      "b2_replay_runner_import_count": 0,
      "detector_import_count": 0,
      "execution_wrapper_import_count": 0,
      "fq_module_import_count": 0,
      "legacy_fj_runner_import_count": 0,
      "mt5_or_ea_module_import_count": 0
    },
    "prohibited_execution_counts": {
      "atr_event_generation_count": 0,
      "b2_runner_execution_count": 0,
      "detector_execution_count": 0,
      "ea_execution_count": 0,
      "fn_interpretation_count": 0,
      "fq_execution_count": 0,
      "legacy_fj_execution_count": 0,
      "mt5_execution_count": 0,
      "optimization_count": 0,
      "outcome_generation_count": 0,
      "tp_sl_calculation_count": 0,
      "wrapper_execution_count": 0
    }
  },
  "schema_version": "fr_prep_b2a_independent_replay_audit.v1",
  "semantic_events_unique": true,
  "short_count": 491,
  "source_rows": 17716,
  "strategy_performance_status": "NOT_EVALUATED",
  "tp_sl_calculated": false,
  "unverified_gaps": 28
}
